data;problem
вы что специально прячите почтоматы и даёте ссылки на них не соответствующие действительности  ужасно ;Городская среда
постомат не доступен  магазин был закрыт  ;Городская среда
в описании пункта выдачи неплохо бы  пояснить  что цокольный этаж - это подвал )) ;Городская среда
магазин  в котором находится постамат открылся только в 10 50  хотя должен был работать с 10 00;Городская среда
"пункт выдачи даже близко не там  где написано  он расположен между ""кантатой"" и ""пиццей паоло""  а вовсе не в торговом зале около ""ароматного мира""  не вводите покупателей в заблуждение  выдавая заведомо ложную информацию о расположении пункта выдачи  очень разочарована";Городская среда
в описании не сказано  что в  н медики по 3 шт имеют одинаковую резьбу ;Городская среда
плохой пункт;Городская среда
в помещении  где находится постомат  очень жарко в такую погоду  градусов +35 в помещении  не кондиционируется  либо система не работает вовсе  если будут заказы с продуктами или товарами с температурными ограничениями  могут быть жалобы от покупателей  либо отказы  возьмите эту информацию себе на заметку  вдруг получится договорится с фикспраймом (магазин в этом помещении)  либо с собственником данных площадей устранить эту проблему  ;Городская среда
подпишите конкретно магазин фикс -прайс  чтобы не искать в фиесте;Городская среда
здравствуйте  не могла найти постмат  здание офисное  много разных магазинов  где именно он стоит не ясно было;Городская среда
к доставке и товару претензий нет  а вот навигация на постомат это нечто  фото якобы пункта постомата намеренно поставили с какого то другого района? чтобы интереснее было искать? ну спасибо  ;Городская среда
работает не с 9:00  а с 10:00;Городская среда
указан неверный адрес пункта выдачи  лютый бред  пришлось искать и тратить время ;Городская среда
в приложении указано время доставки до 14:00 привезли после 16:00;Городская среда
неправильно указан адрес постамата;Городская среда
магазин открывается в 09-00   а помещение где почтомат открывают в 10-00;Городская среда
постомат находился в помещении вейпшопа  с порога его не видно  никакой наклейки  что он здесь нет  в приложении тоже не указано  в каком заведении постомат находится ;Городская среда
"это самый ужасный постомат  который я видел мало того что никакой вывески нет  а фото ""как найти"" не соответствует действительности  так ещё постамат находится в магазине одежды  в дальнем углу за поворотом среди вещей (найти без продавца магазина почти нереально) ";Городская среда
фото нахождения постамата не соответствует действительности постамат находится не в мск кальянной  а в другом месте  пришлось заходить в разные двери и искать ;Городская среда
в первый день не работал постмат получил заказ на следующий день ;Городская среда
если бы можно было бы поставить - 100 постамат засунули в тамбур магазина дикси пишите  что график работы с 00:00 до 23:55 ?? только из-за этого я туда заказал  приехал  постоял у закрытой двери подсказка: магазин с 8:00 до 23:00 в остальное время закрыты  ;Городская среда
постамат находится у дальних касс алкогольного отдела  что совершенно не очевидно и не указано  хотел уйти  но случайно увидел его через окно и стал ходить кругами искать  я никогда не знал что там существуют кассы ;Городская среда
постомат неудобно расположен  стоит за замком  к которому имеет доступ владельцы магазина автомузыки  автомагазин пошел домой  дверь закрывается и постомат недоступен  вынесите постомат на общую площадь с магазином магнит ;Городская среда
сделайте более подробное описание маршрута к постомату по торговцу центру  для человека  который первый раз в него зашёл нифига не понимает  где искать ;Городская среда
постамат стоит в пивнухе  отношение хамское  коробку открыть негде и нечем  мусорки нет  персонал сразу говорит забирайте коробку с собой и уходите  они к нам никакого отношения не имеют  тут же подошёл какой то пьяный дядечка и начал что-то мне втирать  в общем туда я больше ничего заказывать не буду  или смените место постамата или проведите беседу с работниками  где арендуете место  наверняка какие то договорные отношения существуют  я прям расстроена  просто забрала заказ и нахамили и настроение испортили ;Городская среда
в помещение есть доступ не с 9 до 21  а с 10 до 23 ;Городская среда
в описании указано что это оригинальный фильтр  производитель хэндай  на самом деле это аналог фирмы nac  обман ;Городская среда
торговый центр работает с 10:00  время указано в  е с 09:00  при написании в поддержку  а  что не могу ждать час  мне было предложено подождать 1-2 дня для решения проблемы  в тоге постучал в дверь  мне открыли дверь сотрудники тц  дно  просто дно  где   - везде дно  заказывать не буду больше ничего  ;Городская среда
проверить товар в помещении где расположен постомат не возможно так как сотрудники магазина не дают ;Городская среда
ужасный пункт выдачи товаров  пивнушка  где не работает вытяжка  проведённые 2 минуты там — вся одежда воняет  упаковка тоже ;Городская среда
очень сложно найти постамат  описание в приложении не дает точной информации  желательно описать более подробно: какой вход  с какой стороны один из товаров имеет брак  буду обращаться за заменой;Городская среда
не понятно было - где находится постамат  нужно более подробное описание ;Городская среда
получил  заказ со второго раза  приехал в 21 час первый раз  закрыто  хотя на сайте написано до 23:00 график работы  ;Городская среда
нет обозначений   что в магазине присутствует   ;Городская среда
ставлю месту пункта выдачи 1/10  а товару 10/10 пункт работает с 9  а магазин  в котором он находится открывается в 10 :);Городская среда
упаковка была слегка порвана  постамат находится в подвольном помещении  ;Городская среда
навигация где находятся сами пастомат и нумерация ячеек на самом автомате ;Городская среда
исправьте время работы постмата  торговый центр открывается в 10:00   в остальном всё хорошо ;Городская среда
постамат в подвальном помещении и нет никаких указателей;Городская среда
был указан не верный адрес самовывоза  ;Городская среда
место расположения почтомата указано неверно ;Городская среда
постамат находится абсолютно не в очевидном месте  инструкция не сильно помогает  проще спросить у местных продавцов;Городская среда
по адресу: кисловодск  ул  жмакина  18 почему то не доступен для доставки товара постамат  а  хотя этот постамат работает  ;Городская среда
очень неудобно находятся пастоматы  искать тяжело  ;Городская среда
желательно описание подробного расположения коробки  чтобы не искать ее по всему тц  хотя бы этаж;Городская среда
очень расстроилась  что при оформлении было указано время 14 00  но привезли заказ после 18 часов  меня весь день прождал элекктрик  чтоб поменять счетчик  указывайте верное время;Городская среда
в приложении и смс не было указано  где именно находится постамат  был только адрес  пришлось узнавать  куда идти через сайт с негативными комментариями на эту тему для сравнения в озоне всегда указано  как пройти к пункту выдачи ;Городская среда
фотография пункта выдачи не соответствует действительности  пункт невозможно найти  помогла служба поддержки  прислав нормальную фотографию  замените фото на сайте ;Городская среда
надо чтобы в заказе писали  где находится постамат  например постамат по адресу… в магазине верный ;Городская среда
это был квест по нахождению пункта ;Городская среда
находиться в магазине маяк или авокадо (это одно и то же место);Городская среда
неправильная информация о том  как добраться  в магазине ткани нет прохода  и сотрудники явно устали от этого  потому что когда ты не находишь прохода к постамату  тебе очень грубо хамят :) исправьте информацию  там отдельный вход торговое помещение  вход под вывеской дом ткани  войдя  пройти через магазин  в конце зала спустить на несколько ступеней к запасному выходу  постамат расположен вдоль стены ;Городская среда
постомат работает с 10:00  а не с 9:00;Городская среда
писали доставят  в 18  часов  прлждали до 18 10 минут и уехали в сад а 19   10 минут пришла смс товар доставлен  ;Городская среда
каждый раз одно и тоже  приезжаю за заказом после работы  в пятницу в 19-05 уже висят железные жалюзи  та часть магазина  где находится постамт закрыта  приходится ехать с утра  очень неудобно  можно ли перенести аппарат в холл  рядом с другими терминалами?? ;Городская среда
все хорошо  только в описание измените что вход где кофейня кантата;Городская среда
на сайте указано количество 100 шт  по факту продают 2 шт за 371 рублей  развод  ;Городская среда
нет абсолютно никаких указателей что постомат находится именно там  установлен практически в подсобке  ;Городская среда
только со временем была заминка  в место 14 00 привезли в 18 30  плюс  в первый раз сделал заказ ;Городская среда
не очень понятно расположение постамата в помещении  нужен указатель ;Городская среда
не понятно где искать постомат ;Городская среда
описание входа неправильное  там не написано что мини  и салон красоты  а есть только вывеска вайлдберис;Городская среда
магазин дикси внезапно закрыли на технический перерыв  через обещанный час магазин так и не открыли  получил с 3го раза еще через 2 часа  плохой партнер ;Городская среда
график работы указан с 00:00 до 23:55  реально с 9 до 21  поэтому пришлось ехать второй раз ;Городская среда
"всё отлично  только не хватает вывески снаружи здания  что есть постамат "" - ""  либо я не заметил)) ";Городская среда
пункт выдачи никак ни обозначен на доме не понятно где куда заходить ни обозначений ни надписей ни указателей;Городская среда
постамат находится абсолютно не в очевидном месте  инструкция не сильно помогает  проще спросить у местных продавцов;Городская среда
неправильно указано время работы пункта выдачи   в субботу  работает до 19 00 в воскресенье до 18 00 ;Городская среда
в сб в 18-50 пункт был закрыт  а в вск вообще не работал ;Городская среда
на входе в здание отсутствует информация о наличии постампа    ;Городская среда
я в полном шоке: такого сервиса просто не ожидала  приходите  получайте  и не переживайте  если перед вами будет закрыта дверь  порекомендую  а вот постмат в дикси в качестве пункта доставки - однозначно нет ;Городская среда
кошмар  описание пункта выдачи не соответствует реальности  все подвалы  обошла  с большим трудом нашла  просто капец ;Городская среда
нет информации где находится пастомат ;Городская среда
"где ''блин"" вывеска?";Городская среда
пункт выдачи работает до 18  а смс получил 17 45  получить заказ просто невозможно  за-то потом пишут заберите заказ или отправим обратно ????????????? где логика ;Городская среда
спасибо  книга пришла раньше обещанной даты   минус   что в адресе доставки не указано где именно в доме находиться     пришлось ходить по дому и искать  хотелось бы конкретики именно где в какой организации стоят постматы ;Городская среда
очень долго не могла найти постомат  и игрушка не 25 см как указано в описании а меньше;Городская среда
навигатор не показывает в приложении ближайший пункт выдачи ;Городская среда
все хорошо  звезда снята  только за то  что работает помещение  где расположен пастомат   до 18 00  а в выходной до 17 00  не успеваю  работа не позволяет ;Городская среда
устал искать пассамат;Городская среда
это был квест  в доме 23 организации  где искать загадка  ни тебе таблички не другой какой информации  в 2гис тоже ничего  просто адрес где находится дом  а товар упакован отлично  так что претензии исключено к   ;Городская среда
не указано в описании что постоматы находятся относительно грузовых лифтов а не для посетителей которые  замучился искать ;Городская среда
самовывоз постамата  постамат некорректно завершил выдачу заказа  информация о получении не отображалась в приложении в течение часа ;Городская среда
просто ужасно расположен постомат в здание стоит дверь с домофон которая всегда закрыта  звонить не куда пришлось стоять на жаре ждать когда кто-нибудь откроет дверь ;Городская среда
плохое описание места нахождения пункта выдачи ;Городская среда
привезли как и обещали  постомат легко найти  описание подробное;Городская среда
есть идея  когда я в радиусе 50 м от пункта выдачи - приходит пуш чтобы забрал;Городская среда
расположение пункта не соответствует описанию в письме    находиться на цокольном этаже  ;Городская среда
пишите в каком магазине находиться ваш постомат  как то в мирное время  разведчиком приходиться работать  обходить дом  искать постомат))));Городская среда
совершенно не указано где находиться постомат  сам догадайся что он в парикмахерской стоит почему это не написано в карточке заказа ;Городская среда
написано доставят к 17:00  доставили к 18:00  это уже второй раз когда задерживают доставку  ;Городская среда
нет никакого листа руководства по прибору нет на приборе (исилетеле) названия  характеристик ;Городская среда
все хорошо в основном но не указан где стоит постамат на каком этаже приходиться его искать по всему магазину ;Городская среда
адрес пв один  а  -карты показывает совершенно другой  исправьте ошибку  ;Городская среда
неверно указано время работы пункта выдачи  ;Городская среда
привезли не в тот пунк выдачи  ;Городская среда
постамат размещен в узком проходе  всегда заставлен тележками магазина дикси  чтобы попасть к заказу  нужно все двигать самостоятельно   ужасное и неудачное размещение  больше не буду заказывать самовывоз из него  ;Городская среда
здание большое  а где пункт выдачи - неизвестно  хочется более подробной информации в приложении ;Городская среда
"неверно указан адрес: имеется ""пермякова д 50б "" должно быть ""пермякова д 50б/1 """;Городская среда
нет таблички с обозначением пункта;Городская среда
ужасно не понятно где находится сам пункт  плюс это место особо не вызывает доверия ;Городская среда
основной вход закрыт;Городская среда
кассир отказывался искать заказ;Городская среда
не было указателей где находится пастомат ;Городская среда
доступ к постамату только с qr-кодом с госуслуг  о чем не предупреждают перед оплатой  доводы о вакцинации за рубежом сотрудниками магазина-музея  а во внимание не принимаются ;Городская среда
неужели сложно в описании пункта выдачи написать  где именно его искать? по указанному адресу как минимум два места  подходящих под описание  фото входа ещё больше облегчило бы поиски;Городская среда
неправильно указано место нахождения постамата  адрес дома верный  однако вход абсолютно другой;Городская среда
постараться пришлось искать;Городская среда
