data;problem
на экране нет защитной плёнки  покупаю уже не первый регистратор и знаю как товар должен быть упакован  есть незначительные царапины на экране  наводит на мысль что это или б/у или так небрежно упаковывали  ;Товар
не нержавейка  как указано  а оцинковка;Товар
отвратительно;Другое
это не рафаэлло  это плохая подделка  ужасно ;Товар
диск погнут  возможно во время трансортировки   за счет этого будет биение диска и плохой пил  просьба заменить товар;Товар
плохое качество игрушки  весь мятый  прошит очень неряшливо  1500 рублей не стоит ;Товар
как же задолбали   все время не тот товар привозят;Доставка
отвратительно;Другое
некорректно указано время работы ;Городская среда
100  подделка да ещё и с неправильным описанием модели на сайте  это отвратительно для такого крупного сервиса;Товар
19 дней с москвы до нижнего новгорода  сами себе оценку оставьте  ;Доставка
привезли не совсем вовремя  обычно не важен день доставки  но в этот раз нужно было именно в то время  что было указано при оформлении заказа  в итоге  пришлось задержать приём таблеток собаке  т к  смогла получить только на след день;Доставка
заказала 8 кашпо  ждала 7 дней доставки  на 7-ой день написали  что заказ отменён  служба поддержки не могла объяснить причину отмены  новый заказ пришлось ждать ещё 7 дней  на свой риск разбила заказ на 2 части - по 4 кашпо  итого получения товара пришлось ожидать 14 дней  причём не факт  что привезли бы  если бы я не разбила заказ  почему при оформлении заказа не учитывается размер посылки? и почему нельзя оперативно решить этот вопрос с поддержкой  когда произошла отмена  почему не говорят причину отмены и нельзя связаться именно с доставкой?;Доставка
"подделка  код проверялся 25 раз и просрочен  защитная плёнка наклеена криво; мерная шкала тоже кривая  не ведитесь на цену ";Товар
подделка  изготовлена из крученой проволоки  хрень ;Товар
5 дней жду  и нет реакции кроме ждите;Доставка
неверно указано время работы ;Городская среда
китайская подделка;Товар
все 3 гидрогелевые плёнки оказались бракованными  после наклейки появляется не понятная рельефность сечатого характера  которая не «рассасывается и не исчезает даже после нескольких дней  ;Товар
два пакетика корма кошачьего продали за 700 рублей  а так всё ничего  это акция такая  а теперь я должна вести переписку  чтобы мне вернули деньги за вычитом двух пакетиков никогда и никому не посоветую с вами иметь дело ;Товар
проблему с менеджерами решили  скорее всего на складе повредили банку ;Товар
отвратительно ;Другое
уберите из быстроденег постмат  идешь как за займом  ;Городская среда
уже не в первый раз заказ привозят не в то время которое указано в доставке;Доставка
опять постмат заставлен тележками;Городская среда
"отвратительно работает служба доставки  второй раз не привозят в назначенное время  и всегда один ответ -""что-то пошло не так"" руководству надо принимать меры  а не писать отписки  сам   вполне устраивает  но служба доставки отвратительно работает последнее время  поэтому оценка только 3";Доставка
неприятный осадок от полученного товара  голимая подделка  к тому-же не качественная : какие-то дырки на товаре  край я не ровные  куча заусенец  одним словом - отвратительно ;Товар
ужасная подделка  как вернуть деньги? ;Товар
подключил по инструкции  включил автомат в щитке и произошло короткое замыкание   которое он не выдержал (;Постамат
запоздало время доставки ;Доставка
неудобное время работы постомата с 10 до 19   что мешало разместить в магазинах работающих хотя бы до с 8 до 23   таких вокруге минимум 2 ;Городская среда
безобразная работа   сервиса долгое время пытался получить товар в то время как   поддержка молчала и не смогла никак помочь ожидание пока оператор техподдержки  -ящиков очень затяжное ждал пока они проснутся у себя и возьмут трубку минут 10 что особенно пробесило чуть начал рассказывать  что так безобразно работать нельзя и надо сопровождать клиента от момента заказа до момента выдачи товара тут же пошли отмазки мол это не мы  это они - другие виновато но     платформа вообще тут не причем в итоге впечатление об  е окончательно сформировалось и об службе   в целом ничего здесь больше не буду заказывать и своим друзьям и знакомым скажу чтобы не связывались с вашим сервисом потому что это нервы  напряжение и потраченное время на то   чтобы клиент судорожно пытался сам решить проблему которую создал ему ваш сервис всего плохого ;Доставка
масляный фильтр подделка к  у по поводу доставки претензий нет но сам товар подделка плохо сделанная;Товар
время доставки;Доставка
перенос срока доставки  ;Доставка
грубая подделка ;Товар
переносили доставку два раза  про третий перенос решили вообще не сообщать  итог: корм для кошки ждала 7 дней  дождалась  ;Доставка
опять закрыты жалюзи на подходе к постомату  либо разберитесь с арендодателем  либо измените время работы постомата  ;Городская среда
поставил бы оценку больше  если бы впечатление не испортили три параллельных заказа  которые пришли с опозданием и без информирования об этом ;Доставка
у данного товара есть проблема с bluetooth  как выяснилось кривая прошивка  при обновлении проблема не ушла  в связи с чем очень долго подключается пульт ;Товар
товар 09 08 2022 в 15 часов 19 минут не получил  так как товара в ячейке постамата не было  проинформировал магазин в чате  откликнулись оперативно  заказ в розыске ;Товар
неудобное время работы постомата с 10 до 19   что мешало разместить в магазинах работающих хотя бы до с 8 до 23   таких вокруге минимум 2 то;Городская среда
чат поддержки отвратительный   ничего сделать не могут   несколько заказ жду уже 10 дней   хотя они в наличие ;Доставка
всё неплохо  но перенос сроков не порадовал ;Доставка
просьба починить постмат по быковскому шоссе дом 6  большие неудобства при получение товара  на дисплее постмата нет сигнала ;Постамат
постмат не просто найти ;Городская среда
ставлю под вопрос покупки у вас  никогда не было особых проблем  но в этот раз что-то новенькое  этот заказ должны были привезти 6 января  я кое-как получила его сегодня  13 января  каждый день переносилось на следующий  операторы абсолютно отвратительно работали  «ваш заказ 100  привезут завтра»  конечно же его не привозили  потом оператор уже в грубой форме начинает мне писать  все это было в чате  когда позвонила на горячую линию  вроде все было чуть лучше  все обсудили  хотя ничего нового мне не сказали  я попросила связи с менеджерами и тп  составили акт  как заявлено в течении двух дней с вами свяжутся  как думаете  кто-нибудь связался? конечно же нет  отвратительно  просто ужасное отношение к своим покупателям  ;Доставка
при выборе товара была указана доставка в течение 2 дней  по факту товар доставили в постомат через 7 дней ;Доставка
подделка;Товар
больше вопрос к отправителю  а не к самой доставке  почему указано 50шт  а привезти 20шт? ;Товар
неверно указано название торгового центра и время работы  ;Городская среда
неоднократный перенос ;Доставка
подделка ;Товар
электроды подделка ;Товар
подделка скажу друзьям чтобы не покупали ;Товар
неудобное время работы пункта выдачи - по будням с 10 до 19;Городская среда
китайская подделка - никакими 256гб там и не пахнет  реальный объем флешки 3 7гб ;Товар
товар пришел не в то время которое было указано  ;Доставка
постмат неплохо так спрятан ;Городская среда
был перенос сроков доставки ;Доставка
отвратительно и служба поддержки никак не решила ситуацию  отвратительно   ;Другое
ставлю оценку 2 было согнуть иголки не возможно пользоваться я огарчен ;Товар
китайская подделка  сразу же лопнула 6 струна в стац  состоянии  ;Товар
ужасная работа службы доставки   ;Доставка
самовывоз  одинаковые постаматы  но в разных частях города  и странно  что от этого зависит цена доставки  в некоторых постаматах бесплатно  в других платно ;Доставка
каждая позиция облагается доставкой в 149 ? -это провал;Доставка
заедал постмат;Постамат
постамат находится в магазине дисмакс  при оформлении заказа была информация о возможности примерки  но  получив заказ  спросила  можно ли здесь воспользоваться примерочными  на что мне ответили  что примерочные относятся к магазину дисмакс  а не   на последующую просьбу всё же примерить товар  разрешили воспользоваться  доставку одежды на  е оформляла впервые  впечатление двоякое  ;Доставка
чехол не фирменный samsung  подделка ;Товар
подделка;Товар
несвоевременная доставка товара  не оповестили о переносе доставки  потерял время на прлучение;Доставка
отвратительно ;Другое
в описании товара было указано сплитом 4*88 цена 350р  по;Товар
все как указано  кулер не шумный  ;Товар
отвратительно;Другое
впечатление плохое указано что будет в пастомате а он не работал;Постамат
отвратительный сервис  ждать доставку 6 дней и в итоге получить не свой заказ  мошенничество ;Доставка
срок годности одного товара закончился 19 08 2022  а у второго заканчивается на следующий день после получения - 16 10 2022  отвратительный магазин  рассылает просрочку;Товар
ящик был пустой  ждем решения данного вопроса ;Постамат
расстроилась только вначале с курьерской не доставкой   хорошо   что можно было поменять доставку   ;Доставка
нет колесика в которое упирается лезвие;Товар
подделка;Товар
это вода - галимая подделка  не берите ее ;Товар
обманули на 10 дней ;Доставка
банка подделка я в бешенстве;Товар
озвученное время доставки было не выдержано ;Доставка
подделка;Товар
постмат;Другое
некорректно указано время работы  в 19:45 уже был закрыт этаж;Городская среда
отвратительно;Другое
а где же обещанные 500 рублей скидка на первый заказ ?;Другое
через 3 недели перестал работать цветной картридж ;Товар
подделка;Товар
явная подделка  весь пузырёк снаружи залит и залапан;Товар
как будто подделка  кнопка кривая  надеюсь на работу не повлияет  а так обидно  ??;Товар
время доставки не соблюдено ;Доставка
небольшое опоздание в доставке товара ;Доставка
корм пахнет отвратительно ;Товар
это явно был посл заказ на вашем  плейсте;Другое
не сработал постмат ;Постамат
в описании товара указано  что продается 55 шт корзинок  по факту - это одна корзинка за 305 руб  но точно эти же корзинки я  покупала на  е перу недель назад по 68 руб/шт  глупо так обманывать покупателя и продавать  шт за 305 рублей  указывая  в описании товара  что их 55 шт ;Товар
проблема с качеством товара  нанесённой области носа покраснела  и не уходила несколько дней  начало отходить кожа  это после первого дня пользования  другой звёздочкой с аптеки  таких проблем не было  думаю товар подделка ;Товар
не было галаграммы на крышке  что вводит под сомнения в оригинальности данного масла ;Товар
отвратительно  приличных слов нет ;Другое
отвратительно ;Другое
заявлен как макита  а на самом деле дешевая подделка  сопроводительной документации нет;Товар
это подделка ??????;Товар
постмат завис  поддержка некомпетентная  ;Постамат
просто было указано провод с быстрой зарядкой он не поддерживает подделка;Товар
постмат не открыся по команде ;Постамат
в рекламе указано что трос с крюком и с шаклов (скоб)  но пришол без крюка и шакла ;Товар
указано что розетки со шторками но приехали без шторок ;Товар
время работы пункта указано не корректно ;Городская среда
этикетка отклеивается  возможно  подделка;Товар
дешевая подделка не соответсвует оригиналу;Товар
подделка;Товар
самый ужасный сервис  который не может решить проблему ;Поддержка
подложили кошачий наполнитель  просьба разобраться  ;Товар
менажница подделка  блюдце для кошки??;Товар
подделка галимая ;Товар
неверно указано время работы пункта;Городская среда
отвратительно  товар подделка  как вернуть обратно? ;Товар
заказал 2 товара шафран  одна бутылка верно  другая нет  это garam masala spices  внешне очень похоже  но совсем не то и цена почти в 3 раза ниже  надо решить проблему  ;Товар
дисплей пункта работает отвратительно  доставка половина товара ;Постамат
просто отвратительно   кувшин разбит на осколки  деньги не вернули  кувшина нет;Товар
перенос доставки 3 раза  ;Доставка
подделка;Товар
ведро с битумной мастикой к камере доставки лежало на боку  краска залила крышку  что создало проблему при вскытии и дальней шем использовании  ;Товар
провод перестал заряжать через 3 недели ;Товар
обман сплошной больше не закажу ничего отвратительно;Другое
товар не был упакован вообще никак  ни пакета  ни пленки  хотя обычно привозят в коробках  благо корм не пострадал и герметичность не нарушена ;Упаковка
он не подходит как указано в описании товара подделка ;Товар
добрый день  со стороны  а  конечно  логично делать доставку до квартиры бесплатно с определенной суммы  но  возможно  ещё логичнее делать её бесплатной с определенного веса заказа?) и немного вылилось средство  но грустнее  конечно  больная рука пока это все донесёшь до дома ;Доставка
время работы постамата указано неверно;Городская среда
всё хорошо  только хотелось бы сократить время доставки  до 2 х дней ;Доставка
постмат не на видном месте  ;Городская среда
галимая подделка;Товар
подделка?? не настоящий lavazza;Товар
не было сообщения о доставке товара ;Доставка
кокосовое молоко перемороженное  доставка переносилась несколько дней  первоначальная дата доставки товара 4 12 по факту получила 06 12  ;Товар
был перенос ;Доставка
очень  очень маленькие   скорее всего подделка ;Товар
заказ упакован отвратительно  довольно дорогая  технически сложная  электронная вещь упакована просто в пленку  без картона  без мягких пупырок  без паралона или пенопласта  просто два раза обернули в пленку и все  вероятность повреждения во время транспортировки очень высокая ;Упаковка
течет со всех соединений  китайская подделка;Товар
с доставкой всё хорошо  но рассчитывали  что ручка в комплекте: на картинке в описании товара есть  не мы первые так думали   инговый хитрый ход и неприятный осадочек ;Товар
отвратительно 7 дней не отдают оплаченный 100 на 100  товпр  никакой конкретики  только отписки  мошенники  никогда и никому не порекомендую связываться  более того приложу все усилия для публичной огласки  ;Доставка
это подделка   лосьон должен быть голубого цвета  а не прозрачного  на оригинальных флаконах  надписи нарисованы  а не наклеены  извините друзья  но это даже не китай ;Товар
надо только подойтик окну  чтобы в помещении  где постмат  поймать сеть мтс  ;Городская среда
отвратительно  время доставки не соблюдается ;Доставка
огромнейшая просьба решить проблему до завтра - 24 02 22;Другое
подделка ;Товар
отвратительно;Другое
постоянно перенос доставки;Доставка
