data;problem
заказ привезли вовремя  но постамат не работал  ;Постамат
заказала 28 06  обещали привезти 3 07  в назначенный день товар не привезли и информации о точной дате доставке тоже не было  пришлось обращаться в тех поддержку  но там тоже информацию не дали  в результате привезли 5 07 и в этот же день смс пришла  очень расстроена качеством доставки  т к  заказывала в подарок к дню рождения  а он был 4 07 ;Доставка
постамат в этом пункте выдачи (дикси) постоянно заблокирован тележками  которые каждый раз приходится отодвигать  чтоб получить доступ к ячейке;Городская среда
время работы пункта выдачи совпадает с моим временем работы  сложно успеть ;Городская среда
ячейка по коду открылась  но была пустой  товар не получен ;Постамат
хотелось бы пожаловаться на доставку  заказала 2 блока кошачьих кормов и маленькую мягкую игрушку  конечно  я специально заказала доставку на один день  одно время  до сегодняшнего дня все заказы объединяли в один  но сегодня зачем-то сначала один курьер тратил своё время ради одной крошечной игрушки  а затем приехал второй курьер и привёз корм  зачем так сделали не понятно  почему нельзя было передать все заказы одному курьеру  если они все не большие? ;Доставка
товара не доставлен в постамат мошенники ;Товар
написано плохое описание где найти постамат  вход не со двора как написано  ;Городская среда
ничего не получили  ячейка пустая  ;Постамат
не та модель не соответствует по описанию и комплектации  не работает с насадкой (насадки зажимают движущуюся пластину)  прислали модель которая в    е стоит в 3 раза дешевле чем я заплатил  ;Товар
не работает левый наушник;Товар
неудобный доступ к ячейкам при получении в постомате ;Постамат
не открылся постомат при нажатии кнопки в приложении  только через введение кода;Постамат
сломан постамат ;Постамат
постамат открылся не сразу только после второй попытки  написав что заказ не найден;Постамат
плохо ;Другое
"кошмар  вы хотя бы предупреждайте что смс получение отменено  дисплей постамата не отвечает  до поддержки не дозвониться; идиотка в поддержке ничего не может объяснить   если телефон разряжен какой к черту блютус? как другому человеку получить заказ без телефона???? верните смс ";Постамат
дверь постамата заблокирована столом;Постамат
очень плохо  что у 12-ти килограммового мешка отсутствовала какая-либо ручка для переноски из упаковочной верёвки ;Товар
работает  но зделано коряво  не оригенал  пойдeт;Товар
батарея не работает;Товар
код доступа к ячейки пришлось искать на сайте постомата  так как в смс на телефон пришла повреждённая ссылка без кода доступа к ячейки ;Постамат
сломан дисплей  тяжело набираются цифры;Постамат
плохо работает постамат ;Постамат
было сообщение:заказ 117396197 ждёт вас до 28 06 он лежит в 2 ячейках  не забудьте забрать все  код получения — 600567  ya cc/m/3tywkm на код открылась одна ячейка женский костюм пришел  мужского нет;Постамат
кнопки не с первого раза нажимаются когда вводишь код ;Постамат
некорректно работает поставит;Постамат
дисплей на постомате работает не корректно  не все цифры нажимаются с первого и даже второго раза;Постамат
этот постамат не работает  экран белый и нельзя ввести код  открыть ячейку можно только через блютуз;Постамат
с первого раза не открылся;Постамат
получила  всё нормально  только дверь ячейки постмата был открыт я была удивлена);Постамат
не работает ;Другое
отвратительное место  испортилось  забирайте оттуда постамат ;Городская среда
ручка очень плохо пишет  ;Товар
вообще не работает;Другое
кнопки плохо реагируют на нажатие  очень долго пыталась ввести код;Постамат
постамат не открылся  хотя было написано  что открыт  при повторной попытке открыть ячейку - покупка якобы выдана;Постамат
только со второго раза удалось купить   не текущий - не бракованный  смеситель   бывает   спасибо что возврат быстрый   но сам факт того   что новое бывает неисправно неприятен упаковку кагбудто мыши переростки кусали или что с ней делали неясно   коробка  прям пожована была   но смеситель цел  ;Упаковка
получил товар с третьего раза  весь процесс занял месяц ;Доставка
заказ не получен  ячейка не открылась  market yandex  пишет  что заказ получен  в службе поддержки сказали ждите 48 часов  ;Постамат
на торговом центре нет вообще указателей где находится постомат  постоматы других доставок стоят на первом этаже у входа в тц  а ваш постомат стоит в дальнем углу центра на втором этаже без указателей  и в описании постомат нет фото его расположения  если бы не добрые люди я бы его не нашел ;Городская среда
5 упаковок с кормом связаны скотчем в одну неподьемную 12 килограммовую   еле вытащила все это из ячейки  и на полу пыталась раскрепить  ;Постамат
фото не соответствуют пункту пришлось бегать и материть вашу гребаную компанию  которая не потрудилась даже фото пункта изменить ;Городская среда
разбитый товар не вернули в магазин  а положили в ячейку для получения ;Товар
открыл постамат  а ячейка пустая;Постамат
наушники отличные  до этого были dime  indy по звуку отличаются  по-своему как-то  но не скзать  что лушче или хуже  чем dime  чем действительно лучше - это посадкой в ушах  dime постоянно вываливались фирменное приложение поначалу не хотело коннектиться к наушникам  но обнаруживало их и зависало на загрузке при попытке привязки  после сброса наушников привязались с первого раза (нужно еще включить геолокацию) спасибо marvel и    у за такую низкую цену ;Товар
заказ забрал только со второго раза  так как не работал сам терминал выдачи товар очень хорошо упакован  изготовление июль 2022 (свежий) ??;Постамат
постамат работает плохо;Постамат
ячейка была пустой;Постамат
плохо;Другое
нет русского языка в инструкции плохо ;Товар
пункт выдачи во дворе  выскочил в трико  забрать пять секунд  а как можно проверить товар  если он в ячейке? открыл ячейку  всё  ты получил товар  обратно товар уже не засунешь ;Постамат
экран зависал и ввести код получилось с 5 раза ;Постамат
"постамат открылся раза с десятого  нажимаешь ""открыть"" - и ничего не открывается  забыли положить коробку конфет в заказ  ";Постамат
не работает ;Другое
еле-еле работал сенсорный экран  в смс был указан несуществующий код  телефон поддержки включал на 10 минут музыку  а потом вместо ответа оператора просил оценить их работу  постамат 291   отвратительное обслуживание  никому не порекомендую ваш сервис  ;Постамат
сенсор не работал на планшете постамата ;Постамат
не сразу нашли постомат;Городская среда
лампа не работает  несмотря на целые спирали лампа не горит;Товар
набрать код затруднительно и не с первого раза;Постамат
открыл по коду из смс  а ячейка пустая  это кидалово? ;Постамат
постамат не работал  зря потартили время  ждать дня два   чтоб провели ревизию  сервис может и хороший  но не в этот раз;Постамат
не работала сенсорная панель на постамате  удалось открыть ячейку через приложение ;Постамат
плохо работали кнопки 0 и 1   трудно было получать товар из ячеек с кодом где были цифры 0 и1   нет столика для упаковки посылок при большом их количестве  ;Постамат
заказ был оформлен 01 06 с доставкой 06 06  получила по факту 14 06  резиночка склеены  еле разделила  одна так и не разошлась ;Товар
после установки не работает звук и не занружается клавиатура и мышь;Товар
экран на постопате приходилось нажимать по 5 раз на каждое действие  ;Постамат
эта паста работает ;Постамат
как получение? не знаю  даже как выразиться  если без мата  то никак наверно  я его просто не получил  так как ячейка в постамате была пуста  как то не смешно совсем ;Постамат
до этого были насос 350 вт  проработал полгода  отдал на экспертизу  и решил купить ещё один прозапас  мощность 750 вт  а по факту насос еле еле качает  заявленный объём не накачивает  очень жаль  пока работет  ;Товар
ячейка открылась с 4го раза ;Постамат
плохо работает сенсорное табло;Постамат
в постамате плохо работает наборное поле;Постамат
постамат на 2 этаже  лестница отвратительная  с коляской подняться невозможно;Городская среда
с 3 раза открылся;Постамат
"пункт выдачи плохо работал  первый заказ наволочки получила без проблем  набрала код ячейка щёлкнула и открылась  второй заказ прошёл с накладками  набрала код не сразу  приходилось неск раз набирать нужные цифры  особенно плохо набралась цифра""1""  после набора кода  аппарат щёлкнул  но дверца не открылась  на табло высветилось  что заказ находится в ячейке 3в но найти ячейку не удалось  на них отсутствует нумерация  потрогала все дверцы ячеек  все закрыты  набрала второй раз код  та же история повторилась  набрала 3 раз  спасибо помог прохожий  потрогал дверцы  одна открылась  без посторонней помощи я бы не справилась  надо крупно пронумеровать ячейки и периодически проверять замки ячеек  товары пришли в надлежащем качестве  упаковка не нарушена  ";Постамат
не работал экран  не нажимался ни на что  пришлось звонить  и через блютуз открывать;Постамат
не работает;Другое
постамат пришлось долбить всеми пальцами  сенсор очень плохо работает  к товару претензий нет ;Постамат
заказ не получен  ячейка не открылась;Постамат
открыл ячейку товара не было что делать ;Постамат
очень сильно замотали в плёнку  еле разрезал  да ещё и порезался при этом  ;Упаковка
на постомате очень трудно набрать код на получение заказа- плохо реагирует на касания ;Постамат
ячейка не открылась  заказ не удалось забрать;Постамат
нет заявленных 10м  попрошу прислать фото мне и покажу длинну поводка  которая на самом деле    сам материал- стропа очень тонкий  не стоит 1000р никак  ;Товар
вытекла шампунь  написано в службу поддержки  предложили промокод на 700 рублей  но не дали  в общем бардак;Товар
в новом постамате не работал экран (не реагировал на касания)  заказ удалось забрать только на третий день  ;Постамат
магазин в котором установлен постамат на ремонте  мне удалось чудом попасть туда со второго раза тк строители не хотят открывать дверь  у них ремонт  служба поддержки не помогает от слова совсем  за доставку кол  за поддержку кол  колонку проверю попозже;Городская среда
зачем вообще было втыкать постомат в эти 4 квадратных метра  с учетом микрозаймовой организации в соседях? человек ушёл на обед  дверь закрыл ;Городская среда
с первого раза забрать заказ не удалось  не работал постомат;Постамат
постомат работал не корректно;Постамат
нет указателей к постомату  ;Городская среда
постамат неисправен;Постамат
открыв ячейку в постомате ни чего не обнаружено  ячейка была пуста  товар отсутствовал  доставка на высоте ;Постамат
"к сожалению  постамат открылся с трудом  - малая чувствительность кнопок   в приложенной сбоку записке  написанной от руки  предлагалось нажимать""когтем""   ??? понятно  что антивандальная защита  кодового пульта необходима  но набор кода должен быть  оптимизирован  ""когтем""  как-то неудобно ";Постамат
поставьте уже мусорку возле своих постаматов  а то мы начнём обратно в ячейки его класть);Городская среда
один наушник не работает ;Товар
товар не возможно забрать  ячейка не открывается  ;Постамат
в ячейке был не мой заказ  а чужой  жду когда пришлют код получения мого заказа;Товар
к сожалению не работал экран постомата  но по телефону оператор быстро объяснил как можно достать из него посылки ;Постамат
невозможно найти пункт выдачи очень топорно работал сам постомат (почти 2 минуты после ввода кода открывалась ячейка);Городская среда
я не смогла получить свой заказ  служба поддержки (звонила в службу) была вежлива  но ничем помочь не смогла  итог: денег нет  товара нет ;Товар
не очень просто найти постамат  хотя пользуюсь им уже не в первый раз  не помешала бы вывеска или табличка на входе  или хотя бы фото нужного входа на  -картах (в приложении  а такая фотография есть  что сильно помогает) ;Городская среда
в назначенный день посыпать не работал  пришлось идти снова на следующий день  ;Доставка
постамат заставлен тележками магазина и его не видно  нет указателей ;Городская среда
ячейка в постомате была грязная  упаковка посылки вся в грязи и пятнах ;Постамат
не сработала автоматика открытия ячейки (только с введения кода) ;Постамат
потратив пару часов на поиск постамата  надеясь на лучшее  начал тестировать наушники  зарядил достал и  правый не работал вообще  думаю - может не зарядился еще нормально   тестирую звук на левом - ужасно  даже у дешевых f9 за 500р с алика звук был если не лучше  то точно не хуже   спустя время снова достаю правый - не включается  никак  на касания вообще не реагирует из плюсов могу отметить удобный и быстрый возврат товара  на следующий же день приехал курьер и забрал  ;Городская среда
никакого обозначения где находится постомат  только после получения узнал  что он обозначен приложении карта ;Городская среда
солдатик мягкий работал месяц всего гнётся желательно делать новый солдатик сразу ;Товар
как вам доставка? -плохо  посмотрите уже   где у вас расположен этот постамат и исправьте график работы ;Городская среда
один из заказов невозможно было получить из-за того что не открывался не обнаруживался ячейка где находился товар помогали продавцы магазина и покупатели с большой потерей времени еле удалось открыть ячейку с товаром ?;Постамат
в комплекте нет запасной шпули  указана что она в комплекте;Товар
само получение хорошее если бы ещё протереть постамат  а то больно грязный;Постамат
прибор не работал  пришлось сразу же купить новую акумуляторную батарею  ;Товар
почтомат очень плохо работает код вводила около 10 минут;Постамат
не работает ;Другое
ячейка была открыта  ;Постамат
нет никаких указателей  где именно находится постамат  спасибо продавцу магазина  подсказал ;Городская среда
мой код открыл 2 ячейки  в одной из них был  мой заказ в полном комплекте  в другой ячейке был чужой заказ с другим номером и на другое имя  я хочу вернуть чужой заказ  но поддержка не работает;Постамат
два тюбика крема были насмерть перемотаны скотчем  для чего? размотал  теперь они неприятно клеятся к рукам  и  видимо  будут собирать грязь  ;Упаковка
задержали доставку на 2 дня  в чате на мой запрос ответили только на следующий день  а я  в обещанный день доставки взяла отгул за свой счёт((( потеряла и з/п и това не получила(( хоть бы компенсацию какую нибудь предложили-чисто символически  не рекомендую данного продавца-разочарована ;Доставка
получил в пункте выдачи со второго раза  в первый день ячейка была пустая  написал в службу поддержки и на следующий день дали новый код и товар был получен;Постамат
не работает открыть с телефона постомат ;Постамат
