data;problem
клей был упакован в картонную коробку по размеру банки  металическая банка имела вмятину с одной стороны  ;Упаковка
коробка каши была упакована в пакет  в связи с чем пришла вся рваная и мятая;Упаковка
упаковка игрушки повреждена ;Упаковка
странно  что за такую цену отправитель не нашёл двадцати рублей на картонную коробочку  пластиковая упаковка от селёдки  в которую упаковали пасту кппс  треснута в трёх местах от самого дна до крышки  всё вытекло и протекло через пакет  залив жижей всю ячейку постомата    а  выброшенные деньги  пасту проверить не удалось  не покупать здесь никогда ;Упаковка
упаковка была слегка в масле наверно что-то пролилось в ячейке;Упаковка
из одной упаковки линз вытекла жидкость  залив часть коробки;Упаковка
три банки помятые  не умеют сборщики упаковывать  жесть банок мягкая  а их просто в коробку напихали  в коробке они не зафиксированы и при транспортировке друг об друга ударяются  ;Упаковка
получил из постамата  донес до дома  открываю  у одной из упаковок сломана упаковка  хотя упакованы в пупырку  но видимо из за того  что покрыты пупыркой только по краям  вот дно одной из баночек и проломило  как итог почти все содержимое в пакете  большинство ввалившихся таблеток сломано  тут фото не могу прикрепить  но очень хочется  свяжитесь  хочу получить возмещение  ;Упаковка
заказывал моторное масло  получил коробку с протекшим маслом  брать которую руками было просто невозможно  качество товара и упаковки вызвало сомнения  я не стану лить такое масло в двигатель автомобиля  похоже что канистра вскрывалась ранее и что сейчас в неё залито остаётся только гадать  потраченное впустую время и деньги  ;Упаковка
упаковка скраба повреждена  видимо сдавили при доставке - упаковали в пакет  а нужно было в коробку  конечно;Упаковка
плохо упакован товар(;Упаковка
упаковка в состоянии  как-будто её пинали ;Упаковка
шоколад сломался  упакован в пакет ;Упаковка
упаковка повреждена  сабвуфер поцарапан  сломаны терминалы  но я их припаял;Упаковка
товар на фото в приложении и реальный отличаются внешне  упаковки абсолютно разные  похоже на подделку  ;Упаковка
упаковка была в сильно помятом состоянии  поэтому 4 звезды ;Упаковка
упаковано плохо  хорошо что железные банки  одна была помята ;Упаковка
коробки с чаем помяты  чудом упаковка не разорвалась;Упаковка
прокол упаковки с кофе ;Упаковка
у одной пачки кофе нарушена герметичность упаковки;Упаковка
слишком много упаковки  в которой не было необходимости  не экологично ;Упаковка
упаковка товара была повреждена  да так  что торчала мерная ложечка (хорошо  что не потерялась вовсе)  и у пункта выдачи ступеньки и нет пандуса  так что зайти туда с каляской не возможно  ;Упаковка
чипсы приехали открытыми  были раскиданы по всей упаковке  но не в самой пачке ;Упаковка
облита упаковка  растворилась краска на упаковке памперсов  все перепачкал;Упаковка
ненадёжная упаковка  просто пакет  часть спрея вытекла ;Упаковка
почти все кофейные зерна высыпались в упаковочную коробку я  ;Упаковка
упаковка каши повреждена и рассыпалась в пакет    а;Упаковка
очень плохо упакован;Упаковка
товар пришел в ненадлежащем виде  упаковка повреждена  нарушена герметичность бутылки  частично разлился раствор  крышка или была вскрыта или повреждена  след разлитого вещества отпечатался на коробке  бутылка была обернута в стрейч пленку отправителем  возможно уже предвиделось продавцом   что товар может быть испорчен  так оно и получилось  ;Упаковка
"видимо  чтобы упаковать в коробку поменьше стравили воздух из одной пачки чипсов а он там не просто так  а чтобы чипсы не крошились итог - полпачки в ""кашу"" ";Упаковка
вмятины упаковок сока  был надорван доставочный пакет;Упаковка
упаковка от зубной щётки вскрыта;Упаковка
это вообще что такое?  мне как такую коробку дарить?  во-первых она мятая  во-вторых она порванная  в-третьих она вскрыта  вы вообще абалдели чтоль так делать?  пакет не был порван/поврежден  соответственно такую коробку упаковали со склада  фото прикрепить не могу здесь к сожалению;Упаковка
упаковка была нарушена;Упаковка
товар упаковали очень плохо душе не упаковывали вообще   огорчён ;Упаковка
упаковка порвана;Упаковка
упаковка нарушена ;Упаковка
упаковка отвратительная вся мятая пришла ;Упаковка
наушники классные  но упаковка была сильно повреждена ;Упаковка
упаковка рваная (вскрывалась)  возможна подмена   ;Упаковка
две  из 9 заказанных пачек кофе  которые должны быть вакуумными  оказались поврежденными  нарушена целостность упаковки  что привело к разгерметизации упаковки ;Упаковка
принеся домой и вскрыв транспортный пакет   а  я уделалась  сама  и  улила  всё  вокруг  содержимым  посылки   в транспортной упаковке  было миллилитров  80-100  содержимого посылки  я не знаю как так получилось  но мне пришлось перелить остатки средства из обоих бутылок  в  другую  тару    ;Упаковка
оба устройства без оригинальных  упаковок  были завернуты в кусочек картона  пакет и перемотаны скотчем ;Упаковка
хоть бы в пупырку обернули перед тем как класть в пакет ;Упаковка
средство полностью растеклось по всему пакету  ужасная упаковка   пришлось просто выкинуть  деньги на ветер ( ;Упаковка
не четкая инструкция на русском  плохо пропечатана и мелко  упаковано в пленку и коробку  не пролилось  ;Упаковка
коробка не опломбирована имеет следы вскрытия  товар упакован плохо  все болтается как шарики в спортлото  ;Упаковка
по качеству товара претензий не имею  но транспортировка отвратительная  коробка была помятая  паста должна была пойти в бокс подарочный  но с такой упаковкой к сожалению никуда не годится  ;Упаковка
мультиварка пришла с внушительной вмятиной на корпусе  судя по тому  что упаковка сопоставимых повреждений не имеет  мультиварку упаковали уже поврежденную ;Упаковка
упаковки слишком много);Упаковка
масло  которое шло в комплекте  разлилось внутри коробки  весь прибор  инструкция и упаковка в масле ;Упаковка
4 пачки блинной муки были свалены в одну мягкую упаковку  естественно каждая  бумажная пачка помялась и порвалась(несильно) но часть муки просыпалась  можно было хоть в пищевую плёнку обернуть каждую  если проблематично класть товар в коробку  ;Упаковка
две упаковки с кофе не герметичные  имеют повреждения;Упаковка
к сожалению  упаковка была насквозь пробита  из-за чего содержимое частично просыпалось  ;Упаковка
упаковано плохо  плёнка вся порвалась при доставке  на ящике из за этого слезла краска;Упаковка
плохо упаковали  шампунь протёк ;Упаковка
упаковка была вскрыта  возможно часть листов отсутствует  ;Упаковка
банка с краской без упаковки  просто целлофаном обмотана  с двух сторон вмятины;Упаковка
написала в службу поддержки: упаковка была повреждена  чего не было никогда  всегда заказы были исполнены на высоте  кроме последнего;Упаковка
нарушена герметичность упаковки;Упаковка
один пакет с кофе был с поврежденной упаковкой;Упаковка
обе упаковки сильно помяты пипетки вроде бы целые но такое небережное отношение к товару огорчает ;Упаковка
товар упакован в чехол  а вот коробки не было  чехол не жесткий из за чего при перевозке всё может случиться;Упаковка
в эту доставку на удивление проблема с упаковкой   салат был упакован каждая банка в плёнку   а вот 2 металлические банки швепс  и помада просто  лежали  рядом  хотя банки могли и повредить футляр помады  ;Упаковка
 сама упаковка была смята  пакет был герметичен ;Упаковка
упаковка мятая и рваная  а это детское питание ;Упаковка
вскрытая упаковка разветвителя usb;Упаковка
 мыло протекло  упаковывать надо лучше  ;Упаковка
было 2 пакета кофе  один был разорван и все кофе из него высыпалось в упаковочный пакет ;Упаковка
упаковка мягкая  шампунь разлился  положили в один пакет и кофе и шампунь  ;Упаковка
обложки не упакованы  помяты и все в наклейках со штрих кодом  как их на тетради надевать  если наклейку снять- остаётся клейкое пятно  хочу вернуть  их использовать невозможно;Упаковка
отправляли товар лекарство для животных температурадля хранения до +25с  на улице +30+35с  упаковка только п/э мешок  нужно немного думать ;Упаковка
разорвана упаковка  товар частично смят;Упаковка
надо же было догадаться положить хрупкое шоколадное яйцо с бутылкой геля вместе в полиэтиленовый пакет без доп упаковки ;Упаковка
сам процесс от размещения заказа до его получения прошёл без проблем  товар новый  но оригинальная упаковка была вскрыта  присутствовали 2 наклейки-печати подтверждающие «невскрытый»  вилка для кабеля не нашего стандарта  скорее азиатского  так что ее можно сразу выкинуть  ;Упаковка
сама упаковка товара вскрыта;Упаковка
никакой защитной упаковки у банки не было  пакет  в котором ехали товары  порвался  защитная фольга в самой банке так же оказалась повреждена  в связи с чем в обесцвечивающем порошке было всё: банка  бутылка с оксидом  пакет  даже ячейка в постамате  около 50 граммов порошка высыпалось ;Упаковка
товар плохо упакован  пломба на банке повреждена ;Упаковка
жидкий пластырь упаковка повреждена  разорвана и вскрыта   возможно даже был в употреблении  второй товар в порядке  доставка быстрая только за это ставлю 3  ;Упаковка
жидкое средство разлилось  нужно упаковывать в плёнку во избежание такого ;Упаковка
пленка согнута в середине  отклеилась та часть которая должна быть приклеена к телефону  упаковка не погнута;Упаковка
гель для стирки и кофе были упакованы в одну коробку  открыла коробку  а там гель для стирки сильно пролился  в итоге испачкалась коробка  упаковка от кофе и все было залито гелем  а упаковка кофе в дурочках для аромата  туда тоже попал гель ;Упаковка
очень плохо что нарушена упаковка ;Упаковка
на картинке пакет чёрный  изменился дизайн упаковки? ;Упаковка
пакет с арахисом абсолютно не был заранее и весь арахис рассыпался по упаковке  которая не предназначена для продуктов  не знаю кто в этом виноват  но и есть это теперь нельзя  ;Упаковка
не много протекло из одного флакона  не критично  но упаковывать необходимо понадёжнее ;Упаковка
товар либо плохо упакован  либо им играли в футбол до того  как он попал в пункт выдачи  упаковка со средством для мытья посуды была надорвана  соответственно половина упаковки вытекло  весь остальной товар был в разлитой жидкости для мытья посуды  очень плохо  ;Упаковка
пакет с сухим кормом  вообще не был упакован  ни в коробку  ни в ещё пакеты  вообще ничего  в не понятном состоянии  ;Упаковка
одна из самых худших упаковок что я видел;Упаковка
взяли и обмотали 3 товара скотчем  разъединить их без повреждения нельзя  останутся следы клея  а бумажная часть упаковки наверняка частично оторвется от картона не стала даже пытаться  вернула в том виде  в каком прислали  разматывайте скотч сами ;Упаковка
одна упаковка конфет повреждена  как и сами конфеты;Упаковка
из 6 пачек кофе у 4 нарушена герметичность (мягкие)  упаковали в обычный пакетик (лучше в картонной коробке такой товар отправлять)  и ячейка выбрана впритык - видимо  когда запихивали  могли и повредить пачки ;Упаковка
товар очень плохо упакован;Упаковка
упаковка одной лампы была повреждена  но лампа осталась целой  ;Упаковка
упакован плохо  ;Упаковка
упаковка разрезана и переупакована в ещё один пакет  печалька…;Упаковка
упаковка была деформирована из за чего при открытии вылилась часть крема ;Упаковка
около 100 мл было в упаковочном материале  протекло ;Упаковка
один из товаров повредился при транспортировке  вскрылось моющее средство для посуды  прошу учесть при упаковке товара в дальнейшем;Упаковка
пришел как заявлено  всё в комплекте  телефоном довольны  упакован был хорошо;Упаковка
в нескольких местах верхняя  заводская упаковка порвана  упаковки от я  не было совсем ;Упаковка
плохо упакован было вскрыто;Упаковка
не надо так много упаковки;Упаковка
слишком много упаковки;Упаковка
упаковка товара пробита и в каком то масле ;Упаковка
упаковка повреждена  частично разорвана ;Упаковка
казан шикарен   все соответствует описанию прокладка силиконовая есть  коробка оригинальная присутствует  весь ровный и без царапин   упакован хорошо   еда получается без каких либо посторонних запахов;Упаковка
товар пролился   вся упаковка была мокрая   где то 100 мл тоника пролилось ;Упаковка
товар суммарной стоимостью больше 3 тыс упакован в обычный пакет  неужели нельзя использовать коробку? как результат  3 из 5 коробок с лекарствами для животных ужасно смяты и даже раскрыты  отвратительное отношение к покупателю;Упаковка
упаковка порвана;Упаковка
упаковали средство для мытья посуды вместе с канцелярскими товарами  это недопустимо ;Упаковка
упаковочный пакет был вечь мокрый  неясно  что именно пролилось  было неприятно его забирать  срок доставки неоднркратно переносился;Упаковка
омрачило что картонная упаковка была порвана и из неё торчала часть конуса;Упаковка
ну даёте  упаковка порвана  явно же  что специально такой товар упаковали в коробку  позорище ;Упаковка
оксид был плохо упакован ;Упаковка
герметичность пачки кофе нарушена  хотя сам сорт всем устраивает   повреждение упаковки не лучшим образом сказывается на качестве напитка;Упаковка
упаковка отвратительная ;Упаковка
плохо упакован ;Упаковка
пленка обертки порвана   фирменные пломбы вскрыты  внутри провод зарядки небрежно засунут и вся внутренняя часть упаковки мятая  видны следы эксплуатации  один наушник не работает  наушники не синхронизируется ;Упаковка
первый раз сталкиваюсь с такой доставкой  упаковка повреждена  крышка расколотая отсутствует большая её часть содержимое  естественно  вытекло  в обёрточной упаковке фрагментов крышки не обнаружено  значит товар упаковали уже в таком виде  обескуражен  расстроен  негодую ;Упаковка
плохо упакован  крышка открутилась  часть содержимого вылилось  вся упаковка была мокрая ;Упаковка
вакуумная упаковка повреждена ;Упаковка
вчера получил заказ  открыл конверт  внутри упаковка была порвана  монитор разбит;Упаковка
упаковка повреждена и вскрыта фото приложу в отзыве;Упаковка
упаковка - мягкий пакет  из-за этого помяты углы( ;Упаковка
поскольку почему-то по отмененным товарам оценку по неполучению проставить невозможно  ставлю на повторном заказе  заказ № 145354941 многократно переносился  но мне доставил неприятность даже первый перенос  так как уже из-за первого переноса я не смог в нормальных погодных условиях пприменить товар из заказа  отрицательный эффект от этого невозможно оценить  речь о жизни растения  для котого каждый день был критичным  так что неуд по всем фронтам ;Доставка
